{
  "schema": "agent-product-config",
  "schemaVersion": 1,
  "product": "codex",
  "status": "pilot",
  "durableRole": "Operations",
  "roleMappingAuthority": "docs/governance/AGENT-TEAM.md",
  "authorityChain": [
    "Agent.md",
    "docs/governance/REPOSITORY-AUTHORITY.md",
    "docs/governance/AGENT-TEAM.md",
    "docs/ops/ai/CORE-RULES.md",
    "docs/ops/ai/CODEX-RULES.md"
  ],
  "pilotIsolation": {
    "routedProducts": ["codex"],
    "excludedProducts": ["cursor", "chatgpt", "claude-code", "work"]
  },
  "cannotGrant": ["merge", "production", "standing-role", "self-approval"]
}
